{
  "schema_version": 1,
  "asset_type": "vfx",
  "id": "ice_nova",
  "display_name": "Ice Nova",
  "description": "Expanding frost ring with ice shards, swirling mist and glints, for ice skills.",
  "tags": ["ice", "frost", "combat", "area"],
  "author": "OasisFx examples",
  "duration_seconds": 1,
  "loop": false,
  "emitters": [
    {
      "id": "shockwave",
      "kind": "particles_2d",
      "amount": 1,
      "one_shot": true,
      "explosiveness": 1,
      "lifetime_seconds": 0.45,
      "direction_degrees": 0,
      "spread_degrees": 0,
      "initial_velocity_min": 0,
      "initial_velocity_max": 0,
      "scale_min": 0.3,
      "scale_max": 0.3,
      "scale_end_ratio": 6,
      "color_start": "#E8FBFFFF",
      "color_mid": "#9FE6FFAA",
      "color_end": "#5FC8FF00",
      "texture": "ring",
      "texture_size_px": 128,
      "blend_mode": "add"
    },
    {
      "id": "mist",
      "kind": "particles_2d",
      "delay_seconds": 0.05,
      "amount": 14,
      "one_shot": true,
      "explosiveness": 0.8,
      "lifetime_seconds": 0.9,
      "lifetime_randomness": 0.3,
      "emission_shape": "ring",
      "emission_radius": 60,
      "emission_inner_radius": 30,
      "direction_degrees": 0,
      "spread_degrees": 180,
      "initial_velocity_min": 10,
      "initial_velocity_max": 30,
      "tangential_accel_min": 40,
      "tangential_accel_max": 80,
      "scale_min": 0.8,
      "scale_max": 1.3,
      "scale_end_ratio": 1.4,
      "color_start": "#CFF5FF55",
      "color_end": "#8FD3FF00",
      "texture": "soft_circle",
      "texture_size_px": 64,
      "z_index": -1
    },
    {
      "id": "shards",
      "kind": "particles_2d",
      "amount": 24,
      "one_shot": true,
      "explosiveness": 1,
      "lifetime_seconds": 0.55,
      "lifetime_randomness": 0.2,
      "emission_shape": "circle_outline",
      "emission_radius": 10,
      "direction_degrees": 0,
      "spread_degrees": 180,
      "initial_velocity_min": 220,
      "initial_velocity_max": 340,
      "damping_min": 300,
      "damping_max": 420,
      "align_to_velocity": true,
      "scale_min": 0.7,
      "scale_max": 1,
      "scale_end_ratio": 0.4,
      "color_start": "#FFFFFFFF",
      "color_mid": "#B8F0FFFF",
      "color_end": "#4FB4FF00",
      "texture": "streak",
      "texture_size_px": 32,
      "blend_mode": "add"
    },
    {
      "id": "glints",
      "kind": "particles_2d",
      "delay_seconds": 0.15,
      "amount": 10,
      "one_shot": true,
      "explosiveness": 0.4,
      "lifetime_seconds": 0.4,
      "emission_shape": "circle",
      "emission_radius": 70,
      "direction_degrees": -90,
      "spread_degrees": 180,
      "initial_velocity_min": 0,
      "initial_velocity_max": 10,
      "scale_min": 0.5,
      "scale_max": 1,
      "scale_end_ratio": 0,
      "color_start": "#FFFFFFFF",
      "color_end": "#CFF6FF00",
      "texture": "hard_circle",
      "texture_size_px": 8,
      "blend_mode": "add"
    }
  ]
}
