{
  "schema_version": 1,
  "asset_type": "vfx",
  "id": "fire_burst",
  "display_name": "Fire Burst",
  "description": "Short upward burst of flame with embers and a puff of smoke, for fire skills and impacts.",
  "tags": ["fire", "combat", "impact"],
  "author": "OasisFx examples",
  "duration_seconds": 0.8,
  "loop": false,
  "emitters": [
    {
      "id": "smoke",
      "kind": "particles_2d",
      "delay_seconds": 0.1,
      "amount": 10,
      "one_shot": true,
      "explosiveness": 0.6,
      "lifetime_seconds": 1.0,
      "lifetime_randomness": 0.3,
      "emission_shape": "circle",
      "emission_radius": 10,
      "direction_degrees": -90,
      "spread_degrees": 35,
      "initial_velocity_min": 30,
      "initial_velocity_max": 70,
      "gravity": [0, -60],
      "damping_min": 10,
      "damping_max": 20,
      "scale_min": 0.6,
      "scale_max": 1.0,
      "scale_end_ratio": 1.8,
      "color_start": "#4A3A3466",
      "color_end": "#2A222000",
      "texture": "soft_circle",
      "texture_size_px": 64,
      "z_index": -1
    },
    {
      "id": "flame",
      "kind": "particles_2d",
      "amount": 40,
      "one_shot": true,
      "explosiveness": 0.9,
      "lifetime_seconds": 0.6,
      "lifetime_randomness": 0.35,
      "emission_shape": "circle",
      "emission_radius": 6,
      "direction_degrees": -90,
      "spread_degrees": 55,
      "initial_velocity_min": 140,
      "initial_velocity_max": 280,
      "gravity": [0, -220],
      "damping_min": 90,
      "damping_max": 160,
      "scale_min": 0.35,
      "scale_max": 0.8,
      "scale_end_ratio": 0.25,
      "color_start": "#FFE07AE6",
      "color_mid": "#FF6A1A99",
      "color_end": "#B8240C00",
      "texture": "soft_circle",
      "texture_size_px": 40,
      "blend_mode": "add"
    },
    {
      "id": "embers",
      "kind": "particles_2d",
      "amount": 18,
      "one_shot": true,
      "explosiveness": 0.8,
      "lifetime_seconds": 0.9,
      "lifetime_randomness": 0.4,
      "emission_shape": "circle",
      "emission_radius": 6,
      "direction_degrees": -90,
      "spread_degrees": 70,
      "initial_velocity_min": 160,
      "initial_velocity_max": 320,
      "gravity": [0, 380],
      "damping_min": 20,
      "damping_max": 40,
      "scale_min": 0.6,
      "scale_max": 1.0,
      "color_start": "#FFF4C0FF",
      "color_end": "#FF7A2000",
      "texture": "hard_circle",
      "texture_size_px": 8,
      "blend_mode": "add"
    }
  ]
}
