{
  "schema_version": 1,
  "asset_type": "vfx",
  "id": "campfire_loop",
  "display_name": "Campfire Loop",
  "description": "Small looping campfire with embers and smoke for cooking stations and camps.",
  "tags": ["fire", "ambient", "cooking", "loop"],
  "author": "OasisFx examples",
  "duration_seconds": 1.0,
  "loop": true,
  "emitters": [
    {
      "id": "smoke",
      "kind": "particles_2d",
      "amount": 6,
      "one_shot": false,
      "lifetime_seconds": 2.0,
      "preprocess_seconds": 2.0,
      "position": [0, -40],
      "emission_shape": "rect",
      "emission_rect_size": [20, 4],
      "direction_degrees": -90,
      "spread_degrees": 10,
      "initial_velocity_min": 20,
      "initial_velocity_max": 40,
      "scale_min": 0.6,
      "scale_max": 1.0,
      "scale_end_ratio": 2.0,
      "color_start": "#3A302C44",
      "color_end": "#2A222000",
      "texture": "soft_circle",
      "texture_size_px": 64,
      "z_index": -1
    },
    {
      "id": "fire",
      "kind": "particles_2d",
      "amount": 30,
      "one_shot": false,
      "lifetime_seconds": 0.8,
      "lifetime_randomness": 0.3,
      "preprocess_seconds": 1.0,
      "emission_shape": "rect",
      "emission_rect_size": [36, 4],
      "direction_degrees": -90,
      "spread_degrees": 12,
      "initial_velocity_min": 40,
      "initial_velocity_max": 80,
      "gravity": [0, -80],
      "scale_min": 0.5,
      "scale_max": 0.9,
      "scale_end_ratio": 0.2,
      "color_start": "#FFE27AFF",
      "color_mid": "#FF6A1AAA",
      "color_end": "#8A1A0A00",
      "texture": "soft_circle",
      "texture_size_px": 48,
      "blend_mode": "add"
    },
    {
      "id": "embers",
      "kind": "particles_2d",
      "amount": 8,
      "one_shot": false,
      "lifetime_seconds": 1.4,
      "preprocess_seconds": 1.0,
      "emission_shape": "rect",
      "emission_rect_size": [30, 4],
      "direction_degrees": -90,
      "spread_degrees": 20,
      "initial_velocity_min": 50,
      "initial_velocity_max": 110,
      "tangential_accel_min": -30,
      "tangential_accel_max": 30,
      "scale_min": 0.6,
      "scale_max": 1.0,
      "color_start": "#FFD27AFF",
      "color_end": "#FF5A1000",
      "texture": "hard_circle",
      "texture_size_px": 6,
      "blend_mode": "add"
    }
  ]
}
