{
  "schema_version": 1,
  "asset_type": "vfx",
  "id": "sword_slash",
  "display_name": "Sword Slash",
  "description": "Fast crescent slash trail with a spray of sparks at the end, for melee attacks.",
  "tags": ["slash", "melee", "combat", "impact"],
  "author": "OasisFx examples",
  "duration_seconds": 0.4,
  "loop": false,
  "emitters": [
    {
      "id": "arc_glow",
      "kind": "particles_2d",
      "rotation_degrees": -40,
      "amount": 28,
      "one_shot": true,
      "explosiveness": 0,
      "lifetime_seconds": 0.2,
      "emission_offset": [0, -64],
      "direction_degrees": 0,
      "spread_degrees": 0,
      "initial_velocity_min": 0,
      "initial_velocity_max": 0,
      "orbit_velocity_min": -2.5,
      "orbit_velocity_max": -2.5,
      "scale_min": 1,
      "scale_max": 1,
      "scale_end_ratio": 0.3,
      "color_start": "#9FD8FF66",
      "color_end": "#3F80FF00",
      "texture": "soft_circle",
      "texture_size_px": 48,
      "blend_mode": "add",
      "z_index": -1
    },
    {
      "id": "arc",
      "kind": "particles_2d",
      "rotation_degrees": -40,
      "amount": 56,
      "one_shot": true,
      "explosiveness": 0,
      "lifetime_seconds": 0.2,
      "emission_offset": [0, -64],
      "direction_degrees": 0,
      "spread_degrees": 0,
      "initial_velocity_min": 0,
      "initial_velocity_max": 0,
      "orbit_velocity_min": -2.5,
      "orbit_velocity_max": -2.5,
      "scale_min": 1,
      "scale_max": 1.1,
      "scale_end_ratio": 0.15,
      "color_start": "#FFFFFFFF",
      "color_mid": "#BFE9FFDD",
      "color_end": "#6FB8FF00",
      "texture": "soft_circle",
      "texture_size_px": 20,
      "blend_mode": "add"
    },
    {
      "id": "sparks",
      "kind": "particles_2d",
      "position": [50, 36],
      "delay_seconds": 0.15,
      "amount": 12,
      "one_shot": true,
      "explosiveness": 0.9,
      "lifetime_seconds": 0.3,
      "direction_degrees": 40,
      "spread_degrees": 40,
      "initial_velocity_min": 200,
      "initial_velocity_max": 380,
      "damping_min": 400,
      "damping_max": 600,
      "align_to_velocity": true,
      "scale_min": 0.6,
      "scale_max": 1,
      "color_start": "#FFFFFFFF",
      "color_end": "#9FD8FF00",
      "texture": "streak",
      "texture_size_px": 16,
      "blend_mode": "add"
    }
  ]
}
