{
  "schema_version": 1,
  "asset_type": "vfx",
  "id": "cooking_success",
  "display_name": "Cooking Success Sparkle",
  "description": "Golden sparkle burst with confetti, a warm glow and a little steam when a dish is completed.",
  "tags": ["cooking", "success", "ui", "celebration"],
  "author": "OasisFx examples",
  "duration_seconds": 1.2,
  "loop": false,
  "emitters": [
    {
      "id": "glow",
      "kind": "particles_2d",
      "amount": 1,
      "one_shot": true,
      "explosiveness": 1,
      "lifetime_seconds": 0.5,
      "direction_degrees": 0,
      "spread_degrees": 0,
      "initial_velocity_min": 0,
      "initial_velocity_max": 0,
      "scale_min": 1.2,
      "scale_max": 1.2,
      "scale_end_ratio": 1.6,
      "color_start": "#FFE89A99",
      "color_end": "#FFC24A00",
      "texture": "soft_circle",
      "texture_size_px": 128,
      "blend_mode": "add",
      "z_index": -1
    },
    {
      "id": "steam",
      "kind": "particles_2d",
      "delay_seconds": 0.2,
      "amount": 6,
      "one_shot": true,
      "explosiveness": 0.3,
      "lifetime_seconds": 1,
      "emission_shape": "rect",
      "emission_rect_size": [60, 0],
      "direction_degrees": -90,
      "spread_degrees": 15,
      "initial_velocity_min": 30,
      "initial_velocity_max": 60,
      "gravity": [0, -30],
      "scale_min": 0.4,
      "scale_max": 0.6,
      "scale_end_ratio": 1.8,
      "color_start": "#FFFFFF40",
      "color_end": "#FFFFFF00",
      "texture": "soft_circle",
      "texture_size_px": 48
    },
    {
      "id": "sparkles",
      "kind": "particles_2d",
      "amount": 22,
      "one_shot": true,
      "explosiveness": 0.85,
      "lifetime_seconds": 0.9,
      "lifetime_randomness": 0.3,
      "emission_shape": "circle",
      "emission_radius": 10,
      "direction_degrees": -90,
      "spread_degrees": 70,
      "initial_velocity_min": 150,
      "initial_velocity_max": 260,
      "gravity": [0, 320],
      "damping_min": 20,
      "damping_max": 40,
      "scale_min": 0.6,
      "scale_max": 1.1,
      "scale_end_ratio": 0.3,
      "color_start": "#FFF6C8FF",
      "color_mid": "#FFD45AFF",
      "color_end": "#FFB03000",
      "texture": "hard_circle",
      "texture_size_px": 10,
      "blend_mode": "add"
    },
    {
      "id": "confetti",
      "kind": "particles_2d",
      "amount": 18,
      "one_shot": true,
      "explosiveness": 0.9,
      "lifetime_seconds": 1.1,
      "lifetime_randomness": 0.2,
      "emission_shape": "circle",
      "emission_radius": 8,
      "direction_degrees": -90,
      "spread_degrees": 60,
      "initial_velocity_min": 160,
      "initial_velocity_max": 260,
      "gravity": [0, 300],
      "damping_min": 40,
      "damping_max": 60,
      "angle_min": 0,
      "angle_max": 360,
      "angular_velocity_min": -540,
      "angular_velocity_max": 540,
      "scale_min": 0.6,
      "scale_max": 1,
      "color_start": "#FFB06AFF",
      "color_mid": "#FFB06AFF",
      "color_end": "#FFB06A00",
      "hue_variation": 0.06,
      "texture": "square",
      "texture_size_px": 8
    }
  ]
}
